"তিনি প্রায় প্রতি রাতে ঘুমাতে পারেন না, ঘুমাতে পারেন না এবং ঘুমিয়ে পড়তে পারেন না, তার মেজাজ খারাপ থেকে খারাপ হচ্ছে, এবং তিনি উদ্বিগ্ন যে তার বিষণ্নতা বা অন্যান্য গুরুতর মানসিক সমস্যা হবে কিনা।"
"সম্প্রতি, আমি সবসময় অনুভব করি যে আমি দুর্বল, এবং আমার চিন্তাগুলি দড়ির জগাখিচুড়ির মতো, ধরতে অক্ষম"
"যতবারই আমি আমার ব্যর্থতার কথা ভাবি, আমি অসহায় বোধ করি, সমাজের দ্বারা গৃহীত না হওয়ার চিন্তায় আমি আমার সাহস হারিয়ে ফেলি, আমি আমার স্বপ্ন পূরণ করতে পারব না এই ভেবে আমি অসহায় বোধ করি।"
"আমার সম্পর্ক সবসময়ই অস্থির থাকে এবং আমি প্রায়ই আবেগগত সমস্যার সম্মুখীন হই, আবেগগত সমস্যাগুলি কীভাবে মোকাবিলা করতে হয় তা না জেনে, যা আমাকে অসহায় এবং হারিয়ে যেতে বাধ্য করে।"
"কখনও কখনও আমি নিয়ন্ত্রণ হারিয়ে ফেলি, খুব বিরক্ত এবং রেগে যাই এবং এমনকি আমার চারপাশের লোকদের উপর রেগে যাই।"
"আমার কাজ চাপযুক্ত এবং প্রতিদিন সমস্যা ও চ্যালেঞ্জ মোকাবেলা করা আমাকে খুব উদ্বিগ্ন করে তোলে, আমি ঘুম হারাতে শুরু করি, আমার ক্ষুধা হারাতে শুরু করি এবং কখনও কখনও নিয়ন্ত্রণের বাইরে বোধ করি"
"আমি সবসময় আমার আবেগ নিয়ন্ত্রণ করতে পারি না, কখনও কখনও আমি হঠাৎ রেগে যাই, এবং কখনও কখনও আমি হঠাৎ নিঃশব্দ হয়ে যাই, নিজেকে আমার আচরণ এবং কর্মক্ষমতা পূর্বাভাস করতে অক্ষম করে তোলে, এবং আমি খুব অস্বস্তি এবং বিভ্রান্ত বোধ করি"
"আমি অতীতের অপ্রীতিকর অভিজ্ঞতার জট থেকে মুক্তি পেতে পারি না এবং যখনই আমি সেই ঘটনাগুলির কথা ভাবি, আমি অসহ্য যন্ত্রণা এবং ক্ষতি অনুভব করি।"
"আমি প্রায়শই নিঃসঙ্গ এবং অসহায় বোধ করি, কেউ আমার অভ্যন্তরীণ জগতের সাথে কথা বলতে পারে না, আমি বিশ্বের দ্বারা পরিত্যক্ত বোধ করি, যা আমাকে খুব বেদনাদায়ক এবং মরিয়া করে তোলে।"
"আমি প্রায়ই আমার ত্রুটিগুলির কারণে নিকৃষ্ট এবং অসহায় বোধ করি, অনুভব করি যে আমি যথেষ্ট ভাল নই, ভালবাসার যোগ্য নই"
"আমার অনেক কাজ এবং অধ্যয়নের চাপ আছে, এবং আমি প্রায়ই ক্লান্ত বোধ করি, কিন্তু আমি জানি না কীভাবে শিথিল করা যায় এবং চাপ থেকে মুক্তি দেওয়া যায়।"
"আমার মেজাজ এত দ্রুত বদলে যায়, খুশি থেকে দুঃখে কিছুক্ষণ লাগে, এমন কেন?"
"অন্য যে কারও তুলনায় আমার ধৈর্য হারানোর সম্ভাবনা বেশি, এবং এর কিছুটা মনে হয় যেন এটি বৃথা দমন করা হয়েছে, সীমার দিকে ঠেলে দেওয়া হয়েছে।"
"যতবারই আমি ডাক্তারের কাছে যাওয়ার বা একজন থেরাপিস্টের সাথে দেখা করার কথা ভাবি, আমি ভয় পাই এবং নিরাপত্তাহীন বোধ করি। আমি চিন্তা করি যে আমার সমস্যাগুলি অন্যদের দ্বারা প্রকাশ করা হবে এবং বিচার করা হবে। এই ভয় আমাকে সাহায্য চাইতে বাধা দেয়।"
"আমি আমার কর্মক্ষেত্রে অনেক হতাশা এবং অবিচারের মুখোমুখি হয়েছিলাম, যা আমাকে আমার জীবনে এত হতাশ এবং আশাহীন করে তুলেছিল।"
আমার সহপাঠীদের দ্বারা আমি বৈষম্যের শিকার হয়েছিলাম এবং মাঝে মাঝে আমি অনুভব করি যে জীবন অর্থহীন
"আমি আমার শরীর এবং চেহারা নিয়ে খুব অসন্তুষ্ট, এবং আমি সবসময় নিজেকে অত্যধিক সমালোচনা করি এবং অস্বীকার করি, যা এমনকি আমার দৈনন্দিন জীবন এবং সামাজিক কার্যকলাপকে প্রভাবিত করে"
"সম্প্রতি আমি প্রায়ই ক্লান্ত এবং দুর্বল বোধ করি, এমনকি সিঁড়ি বেয়ে ওঠা ক্লান্তিকর, আমি কি একজন ডাক্তার দেখাতে পারি"
"আমি মনে করি আমি আমার আবেগ এবং আচরণ নিয়ন্ত্রণ করতে পারি না এবং প্রায়ই আবেগপূর্ণ সিদ্ধান্ত নিতে পারি, এটি কি একটি মানসিক রোগ? কিভাবে এটি চিকিত্সা?"
"আমার হৃদয়ের তলদেশে সমস্ত নেতিবাচক আবেগ দমন করুন, নিজেকে একটু দুর্বল হতে দেবেন না, কিন্তু আমি নিজেকে সংযত করতে পারি না"
আমরা সব সময় লড়াই করেছি এবং প্রতিবার আমাদের কিছু বেদনাদায়ক শব্দ ছিল এবং আমরা ভেঙে পড়ি
"রাস্তায় হাঁটতে হাঁটতে, জিয়াও ঝাং সবসময় অনুভব করত যে তার চারপাশের লোকেরা তার দিকে উঁকি মারছে এবং তার মানসিক অবস্থা আরও বেশি অস্থির হয়ে উঠছে।"
"আমি অনুভব করি যে আমার আন্তঃব্যক্তিক সম্পর্কের মধ্যে একটি সমস্যা রয়েছে। বন্ধু, পরিবারের সদস্য এবং সহকর্মীদের সাথে যোগাযোগ করা এবং যোগাযোগ করা কঠিন। কখনও কখনও এমনকি দ্বন্দ্ব এবং ঝগড়াও হয়। এটি আমাকে খুব হতাশ এবং অসহায় বোধ করে। আমি জানি না কিভাবে সুস্থ সম্পর্ক গড়ে তুলতে হয়"
"আমি কেমন দেখতে এবং আমার শরীর নিয়ে অসন্তুষ্ট ছিলাম, এবং ক্রমাগত স্ব-বিচারক এবং আত্ম-সন্দেহ ছিলাম, যা আমাকে কম আত্মবিশ্বাস এবং আত্মসম্মান নিয়ে ফেলেছিল।"
"আমি প্রায়শই একা এবং অসহায় বোধ করি, যেন কেউ আমাকে সত্যিই বোঝে না এবং আমি মানুষের সাথে সংযোগ স্থাপন করা কঠিন বলে মনে করি, যা আমাকে বিরক্ত করে এবং সমাধান খুঁজে পাওয়া কঠিন করে তোলে"
"আমার বাবা-মায়ের বিবাহবিচ্ছেদের পর, আমি আমার নানীর বাড়িতে বসবাস করছি। যদিও আমি আমার মায়ের সাথে থাকি, আমি সবসময় অনুভব করি যে তিনি আমার নানীর চেয়ে অপরিচিত, এবং আমি জানি না কিভাবে তার সাথে যোগাযোগ করতে হয়।"
"আমার সাফল্যের চেয়ে ব্যর্থতা বেশি, এবং প্রায়শই আমি নিজেকে আশ্বস্ত করি যে আমি যদি চেষ্টা করি তবে এটি পুরস্কৃত হবে, তবে বাস্তবতা প্রায়শই হতাশাজনক।"
"আমার ভয়ের প্রবল অনুভূতি রয়েছে, ভয় যে কিছু ঘটতে পারে, এবং আমি নিজেকে শান্ত করতে পারি না।"
"আমি অনুভব করি যে আমি বিভ্রান্তির মধ্যে রয়েছি, আমি জানি না যে আমি কী চাই এবং আমার কী করা উচিত, যা আমাকে খুব বিরক্ত করে এবং কখনও কখনও আমার কিছু নেতিবাচক আবেগের কারণ হয়।"
"মাঝে মাঝে মন খারাপ হয়, এবং নেতিবাচক আবেগ থেকে বেরিয়ে আসা কঠিন, আমি কীভাবে আমার মানসিকতাকে সামঞ্জস্য করতে পারি?"
"আমি সবসময় অনুভব করি যে আমি যথেষ্ট ভাল নই, যথেষ্ট স্মার্ট নই, যথেষ্ট সুন্দর নই, এবং আমি প্রায়ই নিজেকে নিখুঁতভাবে প্যাকেজ করতে চাই যাতে অন্যরা আমার ত্রুটিগুলি দেখতে না পায়"
"আমি প্রায়শই আমার হৃদয়ে শূন্যতা অনুভব করি, প্রকৃত একাত্মতা এবং উদ্দেশ্যের অভাব বোধ করি।"
"যখনই কেউ আমাকে আঘাত করে বা আমার প্রশংসা করে, আমার সবসময় মনে হয় তারা আমার সাথে প্রতারণা করছে কারণ আমি সম্মানের যোগ্য নই"
আমি সবসময় ভয় পেতাম যে অন্যরা আমার সমালোচনা করবে এবং অস্বীকার করবে এবং আমার আত্মবিশ্বাস কমে যাবে।
আমি জানি না কিভাবে আমার আবেগের সাথে মোকাবিলা করতে হয়। আমি প্রায়ই ছোট ছোট জিনিসের কারণে বিস্ফোরিত হই। আমি অনুভব করি যে আমি আমার আবেগকে নিয়ন্ত্রণ করতে পারি না। এর মানে কি আমার একটি মানসিক সমস্যা আছে?
"আমি ভবিষ্যত সম্পর্কে ভয় এবং অনিশ্চয়তায় পূর্ণ, আমি জানি না কোন পথে যেতে হবে, এবং আমি প্রতিদিন বিভ্রান্ত বোধ করি।"
"আমার সবসময়ই বাধ্যতামূলক লক্ষণ ছিল, প্রায়শই দরজা এবং জানালা বন্ধ আছে কিনা, বৈদ্যুতিক যন্ত্রপাতি বন্ধ আছে কিনা ইত্যাদি বারবার পরীক্ষা করতে হয় এবং যদি এই প্রয়োজনীয়তাগুলি পূরণ না হয় তবে আমি খুব অস্বস্তি এবং ভয় পাই, যা আমার দৈনন্দিন জীবন এবং কাজকে প্রভাবিত করে এবং আমি জানতে চাই যে কীভাবে এই ঝামেলা থেকে মুক্তি পাওয়া যায়।"
"কখনও কখনও আমি বিরক্ত বোধ করি, আমি জানি না কী করব, এবং আমি জানি না যে ভবিষ্যতে আমার জন্য কী রয়েছে এবং আমি খালি বোধ করি।"
"আমি সবসময় একটি বাচ্চা নিতে চেয়েছিলাম, কিন্তু যখন আমি গর্ভবতী ছিলাম, আমি সবসময় অনুভব করি যে আমি একজন ভাল মা হতে পারিনি"
"আমি সবসময় আমার শরীর এবং স্বাস্থ্য নিয়ে চিন্তিত ছিলাম, এই ভয়ে যে আমি বিভিন্ন রোগে আক্রান্ত হতে পারি, যা আমাকে খুব নার্ভাস এবং উদ্বিগ্ন বোধ করত।"
আমি আমার চেহারা এবং ফিগার সম্পর্কে খুব স্ব-সচেতন এবং বাছাই করি এবং আমি প্রায়শই এক ধরণের অন্তহীন আত্ম-সংশোধন এবং পরিবর্তনের মধ্যে পড়ে থাকি
শেখার অক্ষমতা সাধারণ বিষয় এবং আপনি গেম খেলে শেখার বিষয়টিকে আরও মজাদার করে তুলতে পারেন।
"আমি স্পষ্টতই চাই যে কারো উপর নির্ভর করুক, কিন্তু আমি জানি না কিভাবে এটির কাছে যেতে হবে। আমি যতবার চেষ্টা করি, আমি ব্যর্থ হই, এবং তারপর আমি আমার সাহস হারাই এবং মূল পয়েন্টে ফিরে যাই।"
আমি দেখতে পাচ্ছি যে জিনিসগুলির প্রতি আমার আগ্রহ এবং উত্সাহ কমছে এবং আমি সবসময় কিছু করতে কম অনুপ্রাণিত বোধ করি৷ এটি কি একটি মানসিক স্বাস্থ্য সমস্যা?
নিয়মিত মনস্তাত্ত্বিক চাপ আমাদের মানসিক স্থিতিশীলতাকে প্রভাবিত করবে এবং আমাদের শারীরিক স্বাস্থ্যের উপর প্রভাব ফেলতে পারে। মানসিক মানের চাষে আমাদের একটি ভাল কাজ করা উচিত এবং মানসিক স্বাস্থ্য শিক্ষা পরিচালনা করা উচিত।
"আমি এক রাতের জন্য অবৈধভাবে আটক ছিলাম, দুর্বলতার পর্যায়ে অত্যাচারিত হয়েছিলাম, এক কোণে একা কাঁদছিলাম, কেবল অশ্রু অন্ধকারকে আলোকিত করেছিল"
"বয়ঃসন্ধিকালের মানসিক স্বাস্থ্যের ক্ষেত্রে, কীভাবে স্বাস্থ্যকর সম্পর্ক গড়ে তোলা যায়, কীভাবে আপনার আবেগ এবং দাবিগুলি সঠিকভাবে প্রকাশ করা যায় তা শেখা খুব গুরুত্বপূর্ণ।"
"আমি ইদানীং অনেক দুঃস্বপ্ন দেখছি, এবং এই স্বপ্নগুলি আমাকে ভয় এবং অস্বস্তি বোধ করে, এমনকি আমার ঘুমের মান এবং দৈনন্দিন জীবনকেও প্রভাবিত করে।"
"আমি সবসময়ই উদ্বিগ্ন থাকি, যা ঘটছে তা নিয়ে ক্রমাগত চিন্তিত থাকি, বিশেষ করে ছোট ছোট বিষয় নিয়ে, যা আমাকে অস্বস্তিতে ফেলতে পারে।"
"আমি আমার নেতিবাচক চিন্তাগুলিকে থামাতে পারি না, কখনও কখনও এমনকি যখন জিনিসগুলি খারাপ হয় না, তখনও আমি সবচেয়ে খারাপ ভাবি, আমি খুব বিষণ্ণ এবং অসহায় বোধ করি, আমার মনে হয় আমি কখনই এই আবেগ থেকে মুক্তি পেতে পারব না।"
"আমি মনে করি আমার জীবন বিরক্তিকর এবং আবেগ এবং অনুপ্রেরণার অভাব রয়েছে, যা আমাকে হতাশাগ্রস্ত এবং হারিয়ে গেছে"
"আমি প্রায়শই অনিদ্রায় ভুগি, রাতে বিছানায় শুয়ে কাজ, পারিবারিক কাজ এবং সম্পর্কের কথা চিন্তা করি, যার কারণে আমি দিনে মনোযোগ দিতে পারি না, কাজের দক্ষতা কম হয় এবং আমার মেজাজ খুব খারাপ হয়ে যায়।"
"যখন আমি বাধা এবং হতাশার সম্মুখীন হই, তখন আমি মনে করি নিরাপদ থাকার একমাত্র উপায় হল সবকিছু ভুলে যাওয়া।"
"আমি প্রায়ই ক্লান্ত এবং দুর্বল বোধ করি, এমনকি আমি শারীরিক পরিশ্রম না করলেও, আমি প্রায়ই অনিদ্রা এবং নিদ্রাহীনতায় ভুগছি, যা আমাকে খুব অস্বস্তি এবং বিরক্ত বোধ করে"
"কখনও কখনও আমি বিষণ্ণ হয়ে পড়ি, আমি সঠিকভাবে খেতে পারি না, এবং তারপর আমি আমার খাওয়া নিয়ন্ত্রণ করি কারণ আমি ভয় পাই যে অন্যরা আমাকে সঙ্কুচিত হতে দেখবে।"
"আমার বাবা-মা সর্বদা আমার সমালোচনা করেন এবং আমি যা করি তা যথেষ্ট ভাল নয়, এটি আমাকে খুব হতাশাগ্রস্ত এবং হতাশ করে তোলে, আমার মনে হয় আমি কখনই তাদের অনুমোদন এবং প্রশংসা পেতে পারব না"
"আমার সম্পর্ক সবসময়ই খুব অস্থির ছিল, আমি সবসময় আবেগ দ্বারা নিয়ন্ত্রিত থাকি, আমার সম্পর্ককে সুস্থভাবে বজায় রাখতে অক্ষম"
"Xiaoling কলেজে উত্পীড়নের শিকার হয়েছিল, যার কারণে সে নিকৃষ্ট এবং হতাশ হয়ে পড়েছিল৷ আমি কীভাবে তাকে তার আত্মবিশ্বাস এবং মানসিক স্বাস্থ্য পুনর্নির্মাণে সাহায্য করতে পারি?"
আমার পারিবারিক সম্পর্কগুলি জটিল ছিল এবং আমি প্রায়শই চাপ এবং নিরাপত্তাহীন ছিলাম এবং আমি জানতাম না কিভাবে তাদের সাথে মোকাবিলা করতে হবে বা সাহায্যের জন্য কার কাছে যেতে হবে।
"আমার একজন বন্ধু আছে যে সবসময় নেতিবাচক অভিযোগ করে, কোনও কিছুর প্রতি তার কোনও ইতিবাচক মনোভাব নেই এবং আমি অনুভব করি যে তার নেতিবাচক আবেগ আমার আবেগকে প্রভাবিত করে, তবে আমি তার সাথে কীভাবে যোগাযোগ করতে হয় তা জানি না।"
"সম্প্রতি, আমি দেখেছি যে আমার সবসময় অনিদ্রা থাকে, এমনকি যখন আমি ঘুমিয়ে পড়ি, আমি দুঃস্বপ্ন দেখি, এবং ঘুম থেকে ওঠার পরে আমি ভারী বোধ করি, আমার কী করা উচিত?"
মাঝে মাঝে বন্ধুদের সাথে আড্ডা দিতে গিয়ে মনে হয় কথোপকথন শেষ হয়ে গেছে আর বলার কিছু নেই
আমার বাচ্চাকে স্কুলে উত্যক্ত করা হচ্ছে এবং সে এখন খুব প্রত্যাহার করে নিয়েছে এবং আমি জানি না কিভাবে তাকে সাহায্য করব
"যখনই আমি মানুষের সাথে যোগাযোগ করি, আমি সবসময় খুব নার্ভাস বোধ করি। আমি কি বলব জানি না এবং আমি ভয় পাই যে আমি ভুল কথা বলব।"
